S.N. ,Name of the Company,Symbol,Listing Date ,Number of Unit,Type of Listing
1,Prabhu Insurance Limited,PRIN,2081.04.23,653658.07,Bonus
2, IME Life Insurance Company Limited,ILI,2081.04.27,10000000,Bonus
3,Sun Nepal Life Insurance Company Limited,SNLI,2081.04.29,7616000,Bonus
4,Mailung Khola Jal Vidhyut Company Limited ,MKJC,2081.05.11,81768.24,Bonus
5,CEDB Hydropower Development Company Limited,CHDC,2081.05.11,923351,Bonus
6,Nepal Reinsurance Company Limited,NRIC,2081.05.17,6086433.28,Bonus
7,Citizen Investment Trust,CIT,2081.06.09,7439250,Bonus
8,Green Development Bank Limited,GRDBL,2081.06.10,197220,Bonus
9,Suryodaya Womi Laghubitta Bittiya Sanstha Limited,SWMF,2081.06.16,1282108.5372,Bonus
10,National Life Insurance Co. Ltd.,NLICL,2081.07.02,2004666.57,Bonus
11,Corporate Development Bank Limited,CORBL,2081.07.26,250000,Bonus
12,Samaj Laghubitta Bittiya Sanstha Limited,SAMAJ,2081.07.26,28500,Bonus
13,Nepal Lube Oil Limited,NLO,2081.07.29,122040,Bonus
14,Everest Bank Limited,EBL,2081.08.19,11767903.88,Bonus
15,Api Power Company Ltd.,API,2081.08.19,2893298.956,Bonus
16,CEDB Holdings Limited,CHDC,2081.08.19,1024919.61,Bonus
17,Kamana Sewa Bikas Bank Limited,KSBBL,2081.08.19,2296815.27,Bonus
18,Gurans Laghubitta Bittiya Sanstha Limited,GLBSL,2081.08.26,144495,Bonus
19,Arun Valley Hydropower Development Co. Ltd.,AHPC,2081.08.26,1120778,Bonus
20,Swabalamban Laghubitta Bittiya Sanstha Limited,SWBBL,2081.08.26,2066250,Bonus
21,Prabhu Mahalaxmi Life Insurance Limited,PMLI,2081.09.01,4296000,Bonus
22,Bhagawati Hydropower Development Company Limited,BGWT,2081.09.01,228826,Bonus
23,Asha Laghubitta Bittiya Sanstha Ltd,ALBSL,2081.09.12,914302.8,Bonus
24,Hathway Investment Nepal Limited,HATHY,2081.09.17,2574000,Bonus
25,Citizens Bank International Limited,CZBIL,2081.09.17,5680389,Bonus
26,Super Madi Hydropower Limited,SMHL,2081.10.03,1050000,Bonus
27,Sanima Reliance Life Insurance Limited,SRLI,2081.10.06,7690652,Bonus
28,Sahas Urja Limited,SAHAS,2081.10.09,2800000,Bonus
29,Sagarmatha Jalabidhyut Company Limited,SMJC,2081.10.09,532000,Bonus
30,Oriental Hotels Limited ,OHL,2081.10.11,564045.22,Bonus
31,Ru Ru Jalbidhyut Pariyojana Limited,RURU,2081.10.13,739985.48,Bonus
32, National Laghubitta Bittiya Sanstha Limited,NMFBS,2081.10.13,1660868.4,Bonus
33,Soaltee Hotel Limited,SHL,2081.10.28,9290899,Bonus
34,NRN Infrastructure and Development Limited,NRN,2081.10.28,611605.85,Bonus
35,Mandakini Hydropower Limited,MHL,2081.10.28,307984.33,Bonus
36,Chhimek Laghubitta Bittiya Sanstha Limited,CBBL,2081.11.04,2381737.68,Bonus
37,Global IME Bank Limited,GBIME,2081.11.04,19870823.63,Bonus
38,First Micro Finance Laghubitta Bittiya Sanstha Limited,FMDBL,2081.11.08,1110444.21,Bonus
39,Agricultural Development Bank Limited,ADBL,2081.11.08,4035502.2234,Bonus
40,SHIVAM CEMENTS LTD,SHIVM,2081.11.08,4298085,Bonus
41,Himalayan Distillery Limited,HDL,2081.11.11,4008784.97,Bonus
42, Deprosc Laghubitta Bittiya Sanstha Limited,DDBL,2081.11.11,1620887.1336,Bonus
43,Sanima Mai Hydropower Ltd.,SHPC,2081.11.21,3398176.1,Bonus
44, Nepal Lube Oil Limited,NLO,2081.11.25,121437.8,Bonus
45,Standard Chartered Bank Limited,SCB,2081.11.27,6129145,Bonus
46,Sana Kisan Bikas Laghubitta Bittiya Sanstha Limited,SKBBL,2081.12.07,5062477.152,Bonus
47,Laxmi Sunrise Bank Limited,LSL,2081.12.07,11593577.25,Bonus
48,Bindhyabasini Hydropower Development Company Limited,BHDC,2081.12.07,798000,Bonus
49,Support Microfinance Bittiya Sanstha Ltd.,SMB,2081.12.10,148245.09,Bonus
50,Suryodaya Womi Laghubitta Bittiya Sanstha Limited,SWMF,2081.12.10,626199.79,Bonus
51,Sarbottam Cement Limited,SARBTM,2081.12.11,3255000,Bonus
52, Mero Microfinance Laghubitta  Bittiya Sanstha Ltd.,MERO,2081.12.11,990000,Bonus
53,Shine Resunga Development Bank Ltd.,SHINE,2081.12.11,1420107.29,Bonus
54,Kutheli Bukhari Small Hydropower Limited,KBSH,2081.12.11,121867.5,Bonus
55,Super Mai Hydropower Limited,SMHL,2081.12.12,350000,Bonus
56,Chilime Hydropower Company Limited,CHCL,2081.12.12,7983997.2,Bonus
57,Shangrila Development Bank Ltd,SADBL,2081.12.12,1252844.17,Bonus
58,Mountain Energy Nepal Limited,MEN,2081.12.14,3394846.58,Bonus
59,Mahalaxmi BikasBank Limited,MLBL,2081.12.14,1251395.58,Bonus
60, Miteri Development Bank Limited,MDB,2081.12.17,1056734.26,Bonus
61,Nepal SBI Bank Limited,SBI,2081.12.19,3990057.8672,Bonus
62, Forward Microfinance Laghubitta Bittiya Sanstha Limited,FOWAD,2081.12.19,1403899.76,Bonus
63,Radhi Bidyut Company Ltd,RADHI,2081.12.25,833904.7,Bonus
64,Kalika Laghubitta Bittiya Sanstha Ltd,KMCDB,2081.12.25,353705.6525,Bonus
65,Jeevan Bikas Laghubitta  Bittya Sanstha Ltd,JBLB,2081.12.25,1886526.46,Bonus
66,Citizen Investment Trust,CIT,2081.12.25,4240372,Bonus
67,Samata Gharelu Laghubitta Bittiya Sanstha Limited,SMATA,2081.12.26,299584.36,Bonus
68,Lumbini Bikas Bank Ltd.,LBBL,2081.12.31,1055440.24,Bonus
69,Mithila LaghuBitta Bittiya Sanstha Limited,MLBBL,2082.01.12,279303.93,Bonus
70,Shree Investment Finance Co. Ltd.,SIFC,2082.01.12,183168,Bonus
71, Green Ventures Limited,GVL,2082.01.15,3125000,Bonus
72,RSDC Laghubitta Bittiya Sanstha Ltd.,RSDC,2082.01.22,897133.52,Bonus
73,Nepal Hydro Developers Ltd.,NHDL,2082.01.22,287553.08,Bonus
74,Aatmanirbhar Laghubitta Bittiya Sanstha Limited,ANLB,2082.01.26,97714.81,Bonus
75,Nepal Life Insurance Co. Ltd.,NLIC,2082.01.26,8207966.55,Bonus
76,Himalayan Life Insurance Limited,HLI,2082.02.01,11228537.04,Bonus
77,Citizen Life Insurance Limited,CLI,2082.02.11,10625000,Bonus
78,Shikhar Insurance Co. Ltd.,SICL,2082.02.19,2681518,Bonus
79,NESDO Sambridha Laghubitta Bittiya Sanstha Limited,NESDO,2082.02.20,363375,Bonus
80,Sanima Reliance Life Insurance Limited,SRLI,2082.02.25,618588,Bonus
81,Sanima GIC Insurance Limited,SGIC,2082.03.02,1500000,Bonus
82,United IDI Mardi RB Hydropower Limited,UMRH,2082.03.17,177240,Bonus
83,Prabhu Mahalaxmi Life Insurance Limited,PMLI,2082.03.22,3780480,Bonus
84,Nepal Insurance Co. Ltd.,NICL,2082.03.29,2466362.91,Bonus
85,9% ICFC Finance Limited Debenture 2088,ICFCD88,2081.11.18,300000,Corporate Debenture
86,Everest Bank Limited Debenture 2091,EBLD91,2082.01.08,3000000,Corporate Debenture
87, Nifra Green Energy Debenture 6% - 2088/89 ,NIFRAGED,2082.03.25,5000000,Corporate Debenture
88,Bishal Bazar Company Limited,BBC,2081.08.11,39608600,Additional (Promoter of Nepal Govt.)
89, SANJEN JALAVIDHYUT COMPANY LIMITED,SJCL,2081.11.06,3650000,Additional share (Locals of Rasuwa)
90,Suryodaya Womi Laghubitta Bittiya Sanstha Limited,SWMF,2081.05.02,46729.545,FPO
91,Samata Gharelu Laghubitta Bittiya Sanstha Limited,SMATA,2081.08.11,350904.25,FPO
92,Mahuli Laghubitta Bittiya Sanstha Limited,MSLB,2081.10.14,475449.15,FPO
93, Wean Nepal Laghubitta Bittiya Sanstha Limited,WNLB,2082.02.01,51292.5,FPO
94,Swarojgar Laghubitta Bittiya Sanstha Ltd.,SLBBL,2081.12.07,195773,FPO
95,Guardian Micro Life Insurance Limited,GMLI,2081.10.24,7500000,IPO
96,Nepal Micro Insurance Company Limited,NMIC,2081.12.21,7500000,IPO
97,Crest Micro Life Insurance Limited,CREST,2081.12.27,7500000,IPO
98,Om Megashree Pharmaceuticals Limited,OMPL,2082.01.17,6000000,IPO
99,Pure Energy Limited,PURE,2082.02.12,8000000,IPO
100,Muktinath Mutual Fund 1,MNMF1,2081.09.22,"12,50,00,000",Mutual Fund
101,Garima Samriddhi Yojana,GSY,2081.11.01,"12,50,00,000",Mutual Fund
102,NMB Hybrid Fund L- II,NMBHF2,2082.01.07,136484000,Mutual Fund
103,MBL Equity Fund,MBLEF,2082.02.07,121625330,Mutual Fund
104,Reliable Samriddhi Yojana,RSY,2082.03.09,120000000,Mutual Fund
105, Hydroelectricity Investment and Development Company Ltd,HIDCL,2081.05.19,"1,68,59,050",Right
106,Best Finance Company Limited,BFC,2081.05.24,"3,56,074.57",Right
107,Himalaya Urja Bikas Company Limited,HURJA,2081.07.13,"99,00,000",Right
108,Ankhu Khola Jalvidhyut Company Ltd,AKJCL,2081.07.26,"1,20,00,000",Right
109,Liberty Energy Company Limited,LEC,2081.11.02,7500000,Right
110,NLG Insurance Company Ltd.,NLG,2081.11.25,9631220.22,Right
111, Life Insurance Corporation (Nepal) Limited ,LICN,2081.12.03,23468000,Right
112, Balephi Hydropower Limited,BHL,2081.12.19,18279700,Right
113,Ngadi Group Power Ltd.,NGPL,2081.12.19,18512792.225,Right
114,Neco Insurance Limited (NIL),NIL,2082.02.29,5030901.55,Right
115,Sun Nepal Life Insurance Company Limited,SNLI,2082.03.30,10471592,Right
116, Nepal Finance Ltd.,NFS,2082.03.30,299500,Right
