Unnamed: 0,Unnamed: 1,Unnamed: 2,Unnamed: 3,Unnamed: 4,Unnamed: 5
,S.N. ,Name,Type of Listing,Listing Date ,Listed Unit
,1,Kisan Microfinance Bittiya Sanstha Limited,Bonus,2077.04.04,205992.75
,2,Chautari Laghubitta Bittiya Sanstha Limited,Bonus,2077.04.04,130200
,3,Aarambha Laghubitta Bittiya Sanstha Limited,Bonus,2077.04.04,44200
,4,Arun Valley Hydropower Development Company Limited,Bonus,2077.04.04,653109
,5,Sparsha Laghubitta Bittiya Sanstha Limited,Bonus,2077.04.07,107851.9
,6,Samata Laghubitta Bittiya Sanstha Limited,Bonus,2077.04.07,91008
,7,Deprosc Laghubitta Bittiya Sanstha Limited,Bonus,2077.04.07,2320231.32
,8,Sana Kisan Laghubitta Bittiya Sanstha Limited,Bonus,2077.04.08,2141945.13
,9,Mahuli Laghubitta Bittiya Sanstha Limited,Bonus,2077.04.13,204000
,10,Summit Laghubitta Bittiya Sanstha Limited,Bonus,2077.04.18,443000
,11,Soaltee Hotel Limited,Bonus,2077.04.21,10990436
,12,Excel Development Bank Limited,Bonus,2077.04.22,1184472.5
,13,Global IME Laghubitta Bittiya Sanstha Limited,Bonus,2077.04.22,386601.25
,14,Prabhu Insurance Limited,Bonus,2077.04.22,511989
,15,Naya Nepal Laghubitta Bittiya Sanstha Limited,Bonus,2077.04.25,168000
,16,Nepal Bangladesh Bank Limited,Bonus,2077.04.26,4075151
,17,Citizen Investment Trust,Bonus,2077.04.32,2958713.065
,18,IME General Insurance Limited,Bonus,2077.05.01,612360
,19,Nepal Insurance Company Limited,Bonus,2077.05.01,547768.33
,20,Prime Life Insurance Company Limited,Bonus,2077.05.07,2509925
,21,Saptakoshi Development Bank Limited,Bonus,2077.05.10,472267.0368
,22,Samudayik Laghubitta Bittiya Sanstha Limited,Bonus,2077.05.12,320000
,23,Shine Resunga Development Bank Limited,Bonus,2077.05.21,3934356.19
,24,Civil Laghubitta Bittiya Sanstha Limited,Bonus,2077.05.23,57057
,25,Support Laghubitta Bittiya Sanstha Limited,Bonus,2077.05.23,60000
,26,Nagbeli Laghubittta Bittiya Sanstha Limited,Bonus,2077.05.24,435966.7
,27,Womi Laghubitta Bittiya Sanstha Limited,Bonus,2077.05.24,252720
,28,Mithila Laghubitta Bittiya Sanstha Limited,Bonus,2077.05.29,158792.4
,29,Chhyangdi Hydropower Limited,Bonus,2077.06.07,135000
,30,Swabhiman Laghubitta Bittiya Sanstha Limited,Bonus,2077.06.22,148466.4
,31,NMB Laghubitta Bittiya Sanstha Limited,Bonus,2077.06.23,486018.75
,32,Himalayan Bank Limited,Bonus,2077.06.25,8520255.84
,33,Swabalamban Laghubitta Bittiya Sanstha Limited,Bonus,2077.06.28,1635109.84
,34,Himalayan General Insurance Company Limited ,Bonus,2077.07.16,410880
,35,Tinau Mission Development Bank Limited,Bonus,2077.07.17,1373001.7509
,36,Nirdhan utthan Laghubitta Bittiya Sanstha Limited ,Bonus,2077.07.23,3000000
,37,Lumbini General Insurance Company Limited,Bonus,2077.07.26,858000
,38,Narayani Development Bank Limited,Bonus,2077.08.08,218746
,39,Nerude Laghubitta Bittiya Sanstha Limited,Bonus,2077.08.12,596470.5
,40,Vijaya Laghubitta Bittiya Sanstha Limited,Bonus,2077.08.15,292215
,41,Forward Community Microfinance Laghubitta Bittiya Sanstha Limited,Bonus,2077.08.16,1227434
,42,Janautthan Samudayik Laghubitta Bittiya Sanstha Limited,Bonus,2077.08.28,158400
,43,Ridi Hydropower Development Company Limited,Bonus,2077.08.30,265559
,44,Gurans Life Insurance Company Limited,Bonus,2077.09.14,985446
,45,Kumari Bank Limited,Bonus,2077.09.28,13584253.67
,46,NIC Asia Bank Limited,Bonus,2077.10.02,18463537.98
,47,Bank of Kathmandu Limited,Bonus,2077.10.05,11112890
,48,Salt Trading Corporation Limited,Bonus,2077.10.14,384488
,49,First Microfinance Laghubitta Bittiya Sanstha Limited,Bonus,2077.10.14,760704.54
,50,Citizens Bank International Limited,Bonus,2077.10.14,7271853.8318
,51,Sanima Bank Limited,Bonus,2077.10.19,8801380.98
,52,Chilime Jalvidyut Company Limited,Bonus,2077.10.21,5709762.94
,53,Nepal Credit & Commerce Bank Limited,Bonus,2077.10.22,9605997.35
,54,RMDC Laghubitta Bittiya Sanstha Limited ,Bonus,2077.10.27,1348985.14
,55,Miteri Development Bank Limited,Bonus,2077.10.29,1040056.875
,56,Api Power Company Limited,Bonus,2077.11.02,1720561.5
,57,Muktinath Bikas Bank Limited,Bonus,2077.11.03,4865613.17
,58,Himalayan Distillery Limited,Bonus,2077.11.03,2892341.25
,59,Laxmi Laghubitta Bittiya Sanstha Limited ,Bonus,2077.11.03,417450
,60,NLG Insurance Company Limited ,Bonus,2077.11.03,717255
,61,Arun Valley Hydropower Development Company Limited,Bonus,2077.11.03,499162
,62,Kamana Sewa Bikas Bank Limited,Bonus,2077.11.03,1117683.7957
,63,Sanima Mai hydropower Limited,Bonus,2077.11.09,2553100
,64,Ridi Hydropower Development Company Limited,Bonus,2077.11.09,278837
,65,Prime Life Insurance Company Limited,Bonus,2077.11.10,1581253
,66,Everest Bank Limited,Bonus,2077.11.10,4235103.42
,67,Sparsha Laghubitta Bittiya Sanstha Limited,Bonus,2077.11.11,182808.97
,68,ICFC Finance Limited,Bonus,2077.11.11,977638
,69,Asha Laghubitta Bittiya Sanstha Limited,Bonus,2077.11.12,348432
,70,Womi Laghubitta Bittiya Sanstha Limited,Bonus,2077.11.12,833544
,71,Agriculture Development Bank Limited,Bonus,2077.11.13,14334691.0464
,72,Global IME Laghubitta Bittiya Sanstha Limited,Bonus,2077.11.13,713091.08
,73,Standard Chartered Bank Nepal Limited,Bonus,2077.11.13,5608001.47
,74,Mega Bank Nepal Limited,Bonus,2077.11.13,13322695.416
,75,Manjushree Finance Limited,Bonus,2077.11.17,1472636.2746
,76,Tinau Mission Development Bank Limited,Bonus,2077.11.18,1087876.3205
,77,Nepal SBI Bank Limited,Bonus,2077.11.18,5373723.33
,78,Prabhu Bank Limited,Bonus,2077.11.19,10315506.64
,79,Chhimek Laghubitta Bittiya Sanstha Limited,Bonus,2077.11.23,3300000
,80,Machhapuchhure Bank Limited,Bonus,2077.11.23,5946169.31
,81,Laxmi Bank Limited,Bonus,2077.11.23,8831303.56
,82,NMB Bank Limited,Bonus,2077.11.25,18782078.86
,83,Jyoti Bikas Bank Limited ,Bonus,2077.11.25,3495293.44
,84,Arun Kabeli Power Limited,Bonus,2077.11.26,856500
,85,Nabil Bank Limited,Bonus,2077.11.26,33826616.29
,86,Himalayan Bank Limited,Bonus,2077.12.01,13121194
,87,Nepal Sewa Laghubitta Bittiya Sanstha Limited,Bonus,2077.12.04,15000
,88,Lumbini Bikas Bank Limited,Bonus,2077.12.04,1901418.21
,89,Global IME Bank Limited,Bonus,2077.12.04,26566231.8
,90,Nepal Bangladesh Bank Limited,Bonus,2077.12.05,5092410
,91,Mahila Sahayatra Laghubitta Bittiya Sanstha Limited,Bonus,2077.12.05,121000
,92,Century Commercial Bank Limited,Bonus,2077.12.05,6189579.26
,93,Butwal Power Company Limited ,Bonus,2077.12.09,2674787
,94,National Life Insurance Company Limited,Bonus,2077.12.11,3082626.53
,95,Sunrise Banlk Limited,Bonus,2077.12.12,5201330.63
,96,Pokhara Finance Limited,Bonus,2077.12.16,458640.86
,97,RSDC Lagbubitta Bittiya Sanstha Limited,Bonus,2077.12.16,604370.45
,98,NMB Laghubitta Bittiya Sanstha Limited,Bonus,2077.12.16,861873.25
,99,Vijaya Laghubitta Bittiya Sanstha Limited,Bonus,2077.12.17,425659.85
,100,Ngadi Group Power Limited,Bonus,2077.12.23,535554.8
,101,Shree Investment & Finance Company Limited,Bonus,2077.12.23,610998.795
,102,Barun Hydropower Company Limited,Bonus,2077.12.23,127575
,103,Siddhartha Bank Limited,Bonus,2077.12.25,11745320.57
,104,Nepal Bank Limited ,Bonus,2077.12.26,13539384.24
,105,Guheshwori Merchant Banking & Finance Limited ,Bonus,2077.12.26,640000
,106,Civil Bank Limited,Bonus,2077.12.30,6402711.74
,107,Shine Resunga Development Bank Limited,Bonus,2077.12.31,3921241.66
,108,Nepal Investment Bank Limited,Bonus,2078.01.05,18883750
,109,Sana Kisan Laghubitta Bittiya Sanstha Limited,Bonus,2078.01.05,2500573.5642
,110,Garima Bikas Bank Limited,Bonus,2078.01.05,4372230.73
,111,Sadhana Laghubitta Bittiya Sanstha Limited,Bonus,2078.01.07,392004
,112,Chhyangdi Hydropower Limited,Bonus,2078.01.08,141750
,113,Samata Laghubitta Bittiya Sanstha Limited,Bonus,2078.01.16,382233.6
,114,Goodwill Finance Limited,Bonus,2078.01.16,672000
,115,Synergy Power Development Limited,Bonus,2078.01.19,332500
,116,NRN Infrastructure & Development Limited ,Bonus,2078..01.21,322814
,117,Swabhimaan Laghubitta Bittiya Sanstha Limited ,Bonus,2078.01.23,153423.6
,118,Surya Life Insurance Company Limited,Bonus,2078.01.24,1077569
,119,Prime  Commercial Bank Limited,Bonus,2078.01.27,20977874.25
,120,Sahara Bikas Bank Limited ,Bonus,2078.01.27,167888.04
,121,Ganapati Laghubitta Bittiya Sanstha Limited ,Bonus,2078.01.27,166117.5
,122,Infinity Laghubitta Bittiya Sanstha Limited,Bonus,2078.01.28,325099.5
,123,Shikhar Insurance Company Limited ,Bonus,2078.02.11,3840202
,124,Life Insurance Corporation (Nepal) Limited,Bonus,2078.02.25,2010000
,125,Srijana Finance Limited,Bonus,2078.03.03,1151950.17
,126,Nepal Insurance Company Limited,Bonus,2078.03.08,920250.79
,127,Mirmire Laghubitta Bittiya Sanstha Limited,Bonus,2078.03.20,364448.35
,128,Sangrila Development Bank Limited,Bonus,2078.03.20,1303320.2
,129,Nirdhan Utthan Laghubitta Bittiya Sanstha Limited ,Bonus,2078.03.21,1950000
,130,Swarojgar Laghubitta Bittiya Sanstha Limited,Bonus,2078.03.21,453421.77
,131,National Microfinance Laghubitta Bittiya Sanstha Limited,Bonus,2078.03.23,554495.025
,132,Mahila Sahayatra Laghubitta Bittiya Sanstha Limited,Bonus,2078.03.23,133100
,133,Everest Insurance Company Limited,Bonus,2078.03.24,876744
,134,Civil Lagbhubitta Bittiya Sanstha Limited,Bonus,2078.03.24,81876.795
,135,Deprosc Laghubitta Bittiya Sanstha Limited,Bonus,2078.03.27,1508150.3618
,136,Nepal Life Insurance Company Limited,Bonus,2078.03.27,17038098.51
,137,Mahalaxmi Bikas Bank Limited,Bonus,2078.03.28,2703413.96
,138,Mero Microfinance Laghubitta Bittiya Sanstha Limited,Bonus,2078.03.30,1448600
,139,Prabhu Insurance  Limited,Bonus,2078.03.31,1056274.844
,140,Nabil Debenture 2082,Debenture,2077.04.06,2000000
,141,Prabhu Bank Debenture 2084,Debenture,2077.06.06,2000000
,142,SBL Debenture 2084,Debenture,2077.08.04,3000000
,143,Sanima Debenture 2087,Debenture,2077.11.09,3052404
,144,Manjushree Finance Limited Debenture 2085,Debenture,2077.12.31,500000
,145,Nepal Investment Bank Bond 2084,Debenture,2077.12.31,4000000
,146,NCC Debenture 2086,Debenture,2078.02.10,3000000
,147,Kamana Sewa Bikas Bank Limited Debenture 2087,Debenture,2078.03.09,1000000
,148,AJOD Insurance Limited,IPO,2077.04.12,10000000
,149,Sadhana Laghubitta Bittiya Sanstha Limited,IPO,2077..04.21,2177800
,150,NRN Infrastructure & Development Limited,IPO,2077.05.09,11326821
,151,Reliance Life Insurance Limited,IPO,2077.05.22,21000000
,152,Liberty Energy Company Limited,IPO,2077.06.02,15000000
,153,Samaj Laghubitta Bittiya Sanstha Limited,IPO,2077.06.08,200000
,154,General Insurance Company Nepal Limited,IPO,2077.06.26,10000000
,155,Shiva Shree Hydropower Limited,IPO,2077.07.06,14764000
,156,Sanima General Insurance Limited,IPO,2077.07.18,10000000
,157,Mountain Energy Nepal Limited,IPO,2077.08.30,19680270
,158,United Idi Mardi & RB Hydropower Limited,IPO,2077.09.03,4200000
,159,Prabhu Life Insurance Limited,IPO,2077.09.17,20000000
,160,Chandragiri Hills Limited,IPO,2077.10.23,15340910
,161,Nepal Infrastructure Bank Limited,IPO,2077.10.29,200000000
,162,Mahila Laghubitta Bittiya Sanstha Limited ,IPO,2077.12.02,1000000
,163,Green Life Hydropower Limited ,IPO,2077.12.02,18000000
,164,Jyoti Life Insurance Company Limited ,IPO,2077.12.24,22000000
,165,Singati Hydro Energy Limited,IPO,2078.01.14,14500000
,166,RU RU Jalbidhyit Pariyojana Limited ,IPO,2078.01.19,4077055
,167,CEDB Hydropower Development Company Limited,IPO,2078.02.25,8394100
,168,Shikhar Insurance Company Limited,Right ,2077.05.14,3171932
,169,Prudential Insurance Company Limited,Right ,2077.05.21,3849120
,170,NLG Insurance Company Limited,Right ,2077.06.07,3842437.5
,171,Gurans Life Insurance Company Limited,Right ,2077.07.17,9385200
,172,Mega Bank Nepal Limited,Right ,2077.08.03,1840739.63
,173,Civil Laghubitta Bittiya Sanstha Limited,Right ,2077.08.09,1141140
,174,Sambriddhi Finance Company Limited,Right ,2077.08.30,1788249
,175,Sambriddhi Finance Company Limited,Right ,2077.10.18,430639
,176,Nepal Finance Limited,Right ,2077.10.21,1697506.25
,177,Api Power Company Limited,Right ,2077.11.09,5670000
,178,Sahara Bikas Bank Limited,Right ,2077.12.16,921148.7
,179,Nepal Bank Limited ,Right ,2077.12.26,344764
,180,Sana Kisan Laghubitta Bittiya Sanstha Limited,Right ,2078.01.05,12442
,181,Citizen Investment Trust,Right ,2078.01.05,13592592
,182,Narayani Development Bank Limited,Right ,2078.01.08,656169
,183,Multipurpose Finance Company Limited ,Right ,2078.01.14,1759621
,184,Sarathi Nepal Laghubitta Bittiya Sanstha Limited,Right ,2078.03.08,4199
,185,Laxmi Unnnati Kosh,Mutual Fund,2077.05.28,65262360
,186,Sanima Large Cap Fund,Mutual Fund,2077.11.11,120000000
,187,Kumari Equity Fund,Mutual Fund,2078.01.05,100000000
,188,Sunrise Bluechip Fund,Mutual Fund,2078.02.13,125000000
,189,Prabhu Select Fund,Mutual Fund,2078.03.07,125000000
,190,NIBL Samriddhi Fund-2,Mutual Fund,2078.03.11,150000000
